{
  "schema_version": "w1.private.w3-source-retirement/1.0",
  "command_id": "88888888-8888-4888-8888-888888888888",
  "operation": "RETIRE_SOURCE",
  "company_id": "22222222-2222-4222-8222-222222222222",
  "source_id": "33333333-3333-4333-8333-333333333333",
  "retired_at": "2026-09-20T08:33:43Z",
  "target_type": "W3_CORE_RUNTIME",
  "target_ref": "33333333-3333-4333-8333-333333333333"
}
